{
  "$schema": "https://qian.dev/schemas/plugin/v2",
  "id": "qian.bundle.minimal",
  "version": "1.0.0",
  "description": "测试与 SDK 基准组合包：仅 Runtime 与声明式表面装载器，初始插件条目为空。",
  "author": {
    "name": "Qian"
  },
  "license": "Apache-2.0",
  "interface": {
    "displayName": "最小基准组合包",
    "category": "bundle"
  },
  "surfaces": {
    "patch": "./config/qian.patch.yml"
  },
  "inject": [],
  "provides": [],
  "policy": {
    "tier": "system",
    "sandbox": "none",
    "authentication": "ON_INSTALL",
    "required": false
  },
  "scopes": [
    "global"
  ]
}
